{"ball_observations": 527, "bounces": 5, "contacts": 4, "data_quality": "medium", "duration_seconds": 10.471667, "far_player_contacts": 2, "limitations": ["imported_existing_stage3_track", "imported_manual_stage4_events", "external_source_video", "surface_metadata_unavailable", "single_rally_import_read_only", "no_inference"], "near_player_contacts": 2, "rally_id": "rally_001", "schema_version": "metrics.v1", "session_id": "nivel_a2_01", "unknown_player_contacts": 0}
